{
  "version": "1.0.0",
  "seed": 1337,
  "notes": [
    "Starter and expansion packs are generated for the four core factions only.",
    "Jokers are emitted as a separate legendary shard pool because the default Joker count (16) cannot support a 41-card starter+expansion ladder."
  ],
  "packs": {
    "Hearts": {
      "Starter-21": {
        "starting": [
          "HRT-02-FRONT-017",
          "HRT-02-FRONT-006",
          "HRT-02-BACK-027",
          "HRT-03-MIDDLE-033",
          "HRT-04-MIDDLE-046",
          "HRT-06-BACK-052"
        ],
        "recruitables": [
          "HRT-03-MIDDLE-036",
          "HRT-07-MIDDLE-007",
          "HRT-08-MIDDLE-018",
          "HRT-04-MIDDLE-001",
          "HRT-05-MIDDLE-043",
          "HRT-11-MIDDLE-005",
          "HRT-06-MIDDLE-049",
          "HRT-05-FRONT-050",
          "HRT-03-FRONT-051",
          "HRT-03-FRONT-004",
          "HRT-05-FRONT-028",
          "HRT-02-FRONT-010",
          "HRT-07-BACK-040",
          "HRT-10-BACK-034",
          "HRT-06-BACK-042"
        ],
        "all": [
          "HRT-02-FRONT-017",
          "HRT-02-FRONT-006",
          "HRT-02-BACK-027",
          "HRT-03-MIDDLE-033",
          "HRT-04-MIDDLE-046",
          "HRT-06-BACK-052",
          "HRT-03-MIDDLE-036",
          "HRT-07-MIDDLE-007",
          "HRT-08-MIDDLE-018",
          "HRT-04-MIDDLE-001",
          "HRT-05-MIDDLE-043",
          "HRT-11-MIDDLE-005",
          "HRT-06-MIDDLE-049",
          "HRT-05-FRONT-050",
          "HRT-03-FRONT-051",
          "HRT-03-FRONT-004",
          "HRT-05-FRONT-028",
          "HRT-02-FRONT-010",
          "HRT-07-BACK-040",
          "HRT-10-BACK-034",
          "HRT-06-BACK-042"
        ],
        "summary": {
          "count": 21,
          "rowRoles": {
            "FRONT": 7,
            "BACK": 5,
            "MIDDLE": 9
          },
          "rarities": {
            "COMMON": 12,
            "RARE": 7,
            "EPIC": 2
          },
          "rankNames": {
            "2": 4,
            "3": 4,
            "4": 2,
            "5": 3,
            "6": 3,
            "7": 2,
            "8": 1,
            "10": 1,
            "J": 1
          }
        }
      },
      "Expansion-41": {
        "additional": [
          "HRT-12-MIDDLE-058",
          "HRT-10-MIDDLE-012",
          "HRT-08-MIDDLE-008",
          "HRT-13-BACK-031",
          "HRT-12-FRONT-002",
          "HRT-12-BACK-038",
          "HRT-14-MIDDLE-037",
          "HRT-10-MIDDLE-030",
          "HRT-11-BACK-048",
          "HRT-14-FRONT-047",
          "HRT-09-BACK-059",
          "HRT-13-FRONT-054",
          "HRT-11-FRONT-021",
          "HRT-07-FRONT-026",
          "HRT-14-MIDDLE-024",
          "HRT-14-MIDDLE-015",
          "HRT-14-MIDDLE-014",
          "HRT-13-MIDDLE-044",
          "HRT-14-FRONT-029",
          "HRT-13-FRONT-009"
        ],
        "totalWithStarter": [
          "HRT-02-FRONT-017",
          "HRT-02-FRONT-006",
          "HRT-02-BACK-027",
          "HRT-03-MIDDLE-033",
          "HRT-04-MIDDLE-046",
          "HRT-06-BACK-052",
          "HRT-03-MIDDLE-036",
          "HRT-07-MIDDLE-007",
          "HRT-08-MIDDLE-018",
          "HRT-04-MIDDLE-001",
          "HRT-05-MIDDLE-043",
          "HRT-11-MIDDLE-005",
          "HRT-06-MIDDLE-049",
          "HRT-05-FRONT-050",
          "HRT-03-FRONT-051",
          "HRT-03-FRONT-004",
          "HRT-05-FRONT-028",
          "HRT-02-FRONT-010",
          "HRT-07-BACK-040",
          "HRT-10-BACK-034",
          "HRT-06-BACK-042",
          "HRT-12-MIDDLE-058",
          "HRT-10-MIDDLE-012",
          "HRT-08-MIDDLE-008",
          "HRT-13-BACK-031",
          "HRT-12-FRONT-002",
          "HRT-12-BACK-038",
          "HRT-14-MIDDLE-037",
          "HRT-10-MIDDLE-030",
          "HRT-11-BACK-048",
          "HRT-14-FRONT-047",
          "HRT-09-BACK-059",
          "HRT-13-FRONT-054",
          "HRT-11-FRONT-021",
          "HRT-07-FRONT-026",
          "HRT-14-MIDDLE-024",
          "HRT-14-MIDDLE-015",
          "HRT-14-MIDDLE-014",
          "HRT-13-MIDDLE-044",
          "HRT-14-FRONT-029",
          "HRT-13-FRONT-009"
        ],
        "summary": {
          "count": 41,
          "rowRoles": {
            "FRONT": 14,
            "BACK": 9,
            "MIDDLE": 18
          },
          "rarities": {
            "COMMON": 18,
            "RARE": 15,
            "EPIC": 7,
            "LEGENDARY": 1
          },
          "rankNames": {
            "2": 4,
            "3": 4,
            "4": 2,
            "5": 3,
            "6": 3,
            "7": 3,
            "8": 2,
            "9": 1,
            "10": 3,
            "J": 3,
            "Q": 3,
            "K": 4,
            "A": 6
          }
        }
      }
    },
    "Spades": {
      "Starter-21": {
        "starting": [
          "SPD-02-FRONT-020",
          "SPD-02-MIDDLE-031",
          "SPD-03-MIDDLE-049",
          "SPD-04-FRONT-002",
          "SPD-04-BACK-008",
          "SPD-08-BACK-013"
        ],
        "recruitables": [
          "SPD-05-MIDDLE-001",
          "SPD-06-MIDDLE-035",
          "SPD-08-MIDDLE-005",
          "SPD-03-MIDDLE-053",
          "SPD-06-MIDDLE-056",
          "SPD-06-MIDDLE-034",
          "SPD-12-MIDDLE-045",
          "SPD-08-FRONT-037",
          "SPD-02-FRONT-003",
          "SPD-08-FRONT-039",
          "SPD-09-FRONT-055",
          "SPD-05-FRONT-023",
          "SPD-10-BACK-007",
          "SPD-10-BACK-018",
          "SPD-11-BACK-059"
        ],
        "all": [
          "SPD-02-FRONT-020",
          "SPD-02-MIDDLE-031",
          "SPD-03-MIDDLE-049",
          "SPD-04-FRONT-002",
          "SPD-04-BACK-008",
          "SPD-08-BACK-013",
          "SPD-05-MIDDLE-001",
          "SPD-06-MIDDLE-035",
          "SPD-08-MIDDLE-005",
          "SPD-03-MIDDLE-053",
          "SPD-06-MIDDLE-056",
          "SPD-06-MIDDLE-034",
          "SPD-12-MIDDLE-045",
          "SPD-08-FRONT-037",
          "SPD-02-FRONT-003",
          "SPD-08-FRONT-039",
          "SPD-09-FRONT-055",
          "SPD-05-FRONT-023",
          "SPD-10-BACK-007",
          "SPD-10-BACK-018",
          "SPD-11-BACK-059"
        ],
        "summary": {
          "count": 21,
          "rowRoles": {
            "FRONT": 7,
            "MIDDLE": 9,
            "BACK": 5
          },
          "rarities": {
            "COMMON": 12,
            "RARE": 7,
            "EPIC": 2
          },
          "rankNames": {
            "2": 3,
            "3": 2,
            "4": 2,
            "5": 2,
            "6": 3,
            "8": 4,
            "9": 1,
            "10": 2,
            "Q": 1,
            "J": 1
          }
        }
      },
      "Expansion-41": {
        "additional": [
          "SPD-13-MIDDLE-016",
          "SPD-10-MIDDLE-043",
          "SPD-04-MIDDLE-006",
          "SPD-14-MIDDLE-058",
          "SPD-13-MIDDLE-044",
          "SPD-13-MIDDLE-011",
          "SPD-13-MIDDLE-051",
          "SPD-03-FRONT-030",
          "SPD-03-MIDDLE-060",
          "SPD-02-FRONT-033",
          "SPD-11-MIDDLE-024",
          "SPD-13-FRONT-012",
          "SPD-13-FRONT-036",
          "SPD-12-FRONT-052",
          "SPD-14-BACK-042",
          "SPD-12-BACK-026",
          "SPD-11-BACK-021",
          "SPD-14-FRONT-040",
          "SPD-14-FRONT-048",
          "SPD-09-BACK-019"
        ],
        "totalWithStarter": [
          "SPD-02-FRONT-020",
          "SPD-02-MIDDLE-031",
          "SPD-03-MIDDLE-049",
          "SPD-04-FRONT-002",
          "SPD-04-BACK-008",
          "SPD-08-BACK-013",
          "SPD-05-MIDDLE-001",
          "SPD-06-MIDDLE-035",
          "SPD-08-MIDDLE-005",
          "SPD-03-MIDDLE-053",
          "SPD-06-MIDDLE-056",
          "SPD-06-MIDDLE-034",
          "SPD-12-MIDDLE-045",
          "SPD-08-FRONT-037",
          "SPD-02-FRONT-003",
          "SPD-08-FRONT-039",
          "SPD-09-FRONT-055",
          "SPD-05-FRONT-023",
          "SPD-10-BACK-007",
          "SPD-10-BACK-018",
          "SPD-11-BACK-059",
          "SPD-13-MIDDLE-016",
          "SPD-10-MIDDLE-043",
          "SPD-04-MIDDLE-006",
          "SPD-14-MIDDLE-058",
          "SPD-13-MIDDLE-044",
          "SPD-13-MIDDLE-011",
          "SPD-13-MIDDLE-051",
          "SPD-03-FRONT-030",
          "SPD-03-MIDDLE-060",
          "SPD-02-FRONT-033",
          "SPD-11-MIDDLE-024",
          "SPD-13-FRONT-012",
          "SPD-13-FRONT-036",
          "SPD-12-FRONT-052",
          "SPD-14-BACK-042",
          "SPD-12-BACK-026",
          "SPD-11-BACK-021",
          "SPD-14-FRONT-040",
          "SPD-14-FRONT-048",
          "SPD-09-BACK-019"
        ],
        "summary": {
          "count": 41,
          "rowRoles": {
            "FRONT": 14,
            "MIDDLE": 18,
            "BACK": 9
          },
          "rarities": {
            "COMMON": 18,
            "RARE": 15,
            "EPIC": 7,
            "LEGENDARY": 1
          },
          "rankNames": {
            "2": 4,
            "3": 4,
            "4": 3,
            "5": 2,
            "6": 3,
            "8": 4,
            "9": 2,
            "10": 3,
            "Q": 3,
            "J": 3,
            "K": 6,
            "A": 4
          }
        }
      }
    },
    "Diamonds": {
      "Starter-21": {
        "starting": [
          "DIA-02-MIDDLE-044",
          "DIA-02-BACK-020",
          "DIA-03-MIDDLE-013",
          "DIA-04-BACK-059",
          "DIA-02-FRONT-051",
          "DIA-03-FRONT-049"
        ],
        "recruitables": [
          "DIA-05-MIDDLE-060",
          "DIA-05-MIDDLE-002",
          "DIA-07-MIDDLE-031",
          "DIA-02-MIDDLE-011",
          "DIA-03-MIDDLE-003",
          "DIA-04-MIDDLE-048",
          "DIA-04-MIDDLE-042",
          "DIA-06-FRONT-009",
          "DIA-07-FRONT-006",
          "DIA-07-FRONT-029",
          "DIA-06-FRONT-045",
          "DIA-07-BACK-057",
          "DIA-13-FRONT-034",
          "DIA-13-BACK-024",
          "DIA-08-BACK-004"
        ],
        "all": [
          "DIA-02-MIDDLE-044",